<?xml version="1.0" encoding="UTF-8"?>
<category name="quantities" xmlns="http://arachne.uni-koeln.de/schemas/category"
    xmlns:xsi="http://www.w3.org/2001/XMLSchema-instance"
    xsi:schemaLocation="http://arachne.uni-koeln.de/schemas/category category.xsd">
    <display>
        <title>
            <section separator=" / ">
                <field datasource="morphology.Level6">
                    <ifEmpty>
                        <field datasource="morphology.Level5">
                            <ifEmpty>
                                <field datasource="morphology.Level4">
                                    <ifEmpty>
                                        <field datasource="morphology.Level3">
                                            <ifEmpty>
                                                <field datasource="morphology.Level2">
                                                    <ifEmpty>
                                                        <field datasource="morphology.Level1"/>
                                                    </ifEmpty>
                                                </field>
                                            </ifEmpty>
                                        </field>
                                    </ifEmpty>
                                </field>
                            </ifEmpty>
                        </field>
                    </ifEmpty>
                </field>
                <field datasource="befund.Grabungsort"/>
                <field datasource="fabric.CommonName"/>
            </section>
        </title>
        <subtitle>
            <section labelKey="Quantity">
                <field datasource="Dataset.Id" />
            </section>
        </subtitle>

        <datasections>
            <section labelKey="Informationen zur Quantity">
                <field datasource="quantities.RimCount"/>
                <field datasource="quantities.RimWeight" postfix="g"/>
                <field datasource="quantities.RimPercentage" postfix="%"/>
                <field datasource="quantities.HandleCount"/>
                <field datasource="quantities.HandleWeight" postfix="g"/>
                <field datasource="quantities.BaseCount"/>
                <field datasource="quantities.BaseWeight" postfix="g"/>
                <field datasource="quantities.BodySherdCount"/>
                <field datasource="quantities.BodySherdWeight" postfix="g"/>
                <field datasource="quantities.OthersCount"/>
                <field datasource="quantities.OthersWeight" postfix="g"/>
                <field datasource="quantities.Joins"/>
                <field datasource="quantities.MNI"/>
                <field datasource="quantities.MNIWeighted"/>
                <field datasource="quantities.MXI"/>
            </section>
        </datasections>
    </display>
    <facets>
        <facet name="kategorie" labelKey="Kategorie">
            <field datasource="Dataset.TableName"/>
        </facet>
    </facets>
</category>
