<?xml version="1.0" encoding="UTF-8"?>

<!-- just very basic to have at least some definitions -->
<category name="person"
	xmlns="http://arachne.uni-koeln.de/schemas/category"
	xmlns:xsi="http://www.w3.org/2001/XMLSchema-instance"
	xsi:schemaLocation="http://arachne.uni-koeln.de/schemas/category category.xsd">
    <display>
        <title>
        	<section separator=", ">
        		<field datasource="person.FamVatersnameSonst" />
        		<field datasource="person.Namenszusatz" />
        	</section>	
        </title>
        <subtitle>
        	<section separator=", ">
            	<field datasource="person.VornameSonst" />
            	<field datasource="person.Cognomen" />
            	<field datasource="person.Beiname" />	
            </section>
        </subtitle>
        <datasections>
        	<section labelKey="Informationen zur Person">
        		<section labelKey="Informationen zum Namen ">
        			<section labelKey="Namenssynonyme" separator="; ">
        				<field datasource="person.VornameSonstSynonym1" />
            			<field datasource="person.VornameSonstSynonym2" />
            			<field datasource="person.VornameSonstSynonym3" />
            			<field datasource="person.VornameSonstSynonym4" />
        			</section>
        			<section labelKey="Synonyme Vatersname" separator="; "> 
        	 			<field datasource="person.FamVatersnameSonstSynonym1" />
        				<field datasource="person.FamVatersnameSonstSynonym2" />
        	 			<field datasource="person.FamVatersnameSonstSynonym3" />
        	 			<field datasource="person.FamVatersnameSonstSynonym4" />
        		</section>
        		<section labelKey="Synonyme Cognomen" separator="; ">
        			<field datasource="person.CognomenSynonym1" />
        			<field datasource="person.CognomenSynonym2" />
        			<field datasource="person.CognomenSynonym3" />
        			<field datasource="person.CognomenSynonym4" />
        		</section>
        	</section>
        		<section labelKey="Beschreibung">
	            	<field datasource="person.Kurzbeschreibung" />
	            </section>
	            <section labelKey="Titel">
	            	<field datasource="person.Titel" />
	            </section>
	            <section labelKey="Geschlecht">
	            	<field datasource="person.Geschlecht" />
	            </section>
	            <section labelKey="NationalitÃ¤t">
	            	<field datasource="person.EthnieNationalitaet" />
	            </section>
        	</section>
        </datasections>
    </display>
    <facets>
    	<facet name="kategorie" labelKey="Kategorie">
    		<field datasource="Dataset.TableName" />
    	</facet>
    </facets>
</category>