<?xml version="1.0" encoding="UTF-8"?>
<!-- just very basic to have at least some definitions -->
<category xmlns="http://arachne.uni-koeln.de/schemas/category" xmlns:xsi="http://www.w3.org/2001/XMLSchema-instance" name="niton" xsi:schemaLocation="http://arachne.uni-koeln.de/schemas/category category.xsd">
  <display>
    <title>
      <section>
        <field datasource="niton.Sample"/>
      </section>
    </title>
    <subtitle>
      <section>
        <field datasource="niton.Location"/>
      </section>
    </subtitle>
    <datasections>
      <section labelKey="Informationen">
        <section labelKey="Zeit">
          <field datasource="niton.Time"/>
        </section>
      </section>
    </datasections>
  </display>
  <facets>
    <include type="facet_kategorie"/>
  </facets>
</category>
