<?xml version="1.0" encoding="UTF-8"?>
<category xmlns="http://arachne.uni-koeln.de/schemas/category"
	xmlns:xsi="http://www.w3.org/2001/XMLSchema-instance" name="topographie"
	xsi:schemaLocation="http://arachne.uni-koeln.de/schemas/category category.xsd">
	<display>
		<title>
			<section>
				<field datasource="topographie.KurzbeschreibungTopographie" />
			</section>
		</title>
		<subtitle>
			<section separator=", ">
				<section>
					<field datasource="topographie.modernerOrt">
						<ifEmpty>
							<field datasource="ort.Stadt" />
						</ifEmpty>
					</field>
					<field datasource="topographie.antikerOrt" prefix="(" postfix=")">
						<ifEmpty>
							<field datasource="ort.Ort_antik" prefix="(" postfix=")" />
						</ifEmpty>
					</field>
				</section>
				<field datasource="ort.Land" />
			</section>
		</subtitle>
		<datasections>
			<section labelKey="Informationen zur Topographie">
				<include type="ort" />
				<include type="datierung" />
				<section labelKey="Beschreibung">
					<field datasource="topographie.TopographieArt" />
					<field datasource="topographie.TopographieTypus" prefix="Kategorie: " />
					<field datasource="topographie.TopographieTypusZusatz"
						prefix="Zusatz: " />
					<field datasource="topographie.antikeGriechLandschaftTopographie"
						prefix="Antike Landschaft: " />
					<field datasource="topographie.antikeRoemProvinzTopographie"
						prefix="Römische Provinz: " />
					<field datasource="topographie.Ausdehnung" prefix="Ausdehnung: " />
					<field datasource="topographie.antikeQuellen" prefix="antike Quellen: " />
					<field datasource="topographie.freieBeschreibung" prefix="Freie Beschreibung: " />
					<field datasource="topographie.KommentarTopographie" prefix="Kommentar: " />
				</section>
				<section labelKey="Geschichte">
					<field datasource="topographie.GeschichteTopographie" />
				</section>
				<section labelKey="Ausgrabungen">
					<field datasource="topographie.Ausgrabungen" />
				</section>
				<include type="literaturcomplete" />
				<include type="uri" />
			</section>
		</datasections>
		<editorsection>
			<section labelKey="Für Bearbeiter">
				<field datasource="topographie.DatensatzGruppeTopographie" prefix="Datensatz-Gruppe: " />
				<field datasource="topographie.ArbeitsnotizTopographie" prefix="Interne Arbeitsnotiz: " />
				<field datasource="topographie.BearbeiterTopographie" prefix="Erstellt von: " />
				<field datasource="topographie.KorrektorTopographie" prefix="Bearbeitet von: " />
			</section>
		</editorsection>
	</display>
	<facets>
		<include type="facet_kategorie" />
		<include type="facet_ort" />
		<include type="facet_datierung" />
		<include type="facet_literatur" />
		<facet name="topographieart" labelKey="Natürlich oder Anthropogen">
			<field datasource="topographie.TopographieArt" />
		</facet>
		<facet name="topographietypus" labelKey="Art der Topographie">
			<field datasource="topographie.TopographieTypus" />
		</facet>
		<facet name="antikegriechlandschaft" labelKey="Antike Landschaft">
			<field datasource="topographie.antikeGriechLandschaftTopographie" />
		</facet>
		<facet name="regioromitalien" labelKey="Regio Rom/Italien">
			<field datasource="topographie.RegioRomItalienTopographie" />
		</facet>
		<facet name="antikeroemprovinz" labelKey="Römische Provinz">
			<field datasource="topographie.antikeRoemProvinzTopographie" />
		</facet>
	</facets>
</category>
